subject,body,category
Regarding project,report so so for of to bargain for was but is that project,Primary
Regarding meeting,and of agenda will meeting at meeting so to and,Primary
Regarding schedule,discuss at that will percent but of team schedule it be that,Primary
Regarding meetup,or at was meetup it to but photo dinner,Social
Regarding verify,it be verify but in was for this is policy policy,Updates
Regarding verify,login was verify was was verify to so the that at,Updates
Regarding hangout,and or this hangout or this share in the in is,Social
Regarding party,or but this party but for for are invite,Social
Regarding party,be share it party on and be,Social
Regarding party,invite so or party the the will are was the,Social
Regarding bargain,bargain in be are discount are for this be that percent update and,Promotions
Regarding account,for the so of account confirm at are password and,Updates
Regarding team,team be this of so but deadline to at was,Primary
Regarding update,or update be be in the verify was,Updates
Regarding terms,and to terms password the was or for for or,Updates
Regarding meetup,in was will that be that and to be friend meetup it,Social
Regarding deal,on to to and this was so for or percent so deal,Promotions
Regarding office,so but report was office to that meeting,Primary
Regarding hangout,hangout at in of dinner of video the this be on,Social
Regarding cheap,on for bargain at cheap or deal in on,Promotions
Regarding offer,are offer is to at offer are for,Promotions
Regarding verify,this is to so the verify are settings was that of,Updates
Regarding project,but sale for deadline so be meeting is or to or offer be project of,Primary
Regarding meetup,party be in at on and of meetup for the friend,Social
Regarding report,so of that the in was report discuss,Primary
Regarding team,agenda or of team so or of that office,Primary
Regarding bargain,for for cheap bargain presentation of was of be will cheap at that but,Promotions
Regarding settings,is settings on or settings account or this,Updates
Regarding friend,friend or of for is the be photo the or will is,Social
Regarding project,on will be project for discuss is be office,Primary
Regarding account,for it password so the this in be account confirm,Updates
Regarding schedule,it was the and schedule project will and and in be of,Primary
Regarding confirm,at in of was confirm was security so the for be is,Updates
Regarding invite,hangout sale invite in or at discount be to are hangout so for,Social
Regarding terms,password but or that this so policy terms or and in and be,Updates
Regarding discuss,was was report is and but will team will or discuss,Primary
Regarding price,percent and price that so or on the will clearance at,Promotions
Regarding password,it be are or it settings be or this password was verify that,Updates
Regarding bargain,in it for it or discount deal in for bargain and and so,Promotions
Regarding project,discuss was project it is or the project to are,Primary
Regarding presentation,it office are on to and on at be was presentation so,Primary
Regarding hangout,on was photo but the it hangout hangout,Social
Regarding password,so will in policy this will password for to be,Updates
Regarding confirm,confirm is security in this and update will will was be,Updates
Regarding video,but at it is share family in video,Social
Regarding account,password are this it so was for in policy account to,Updates
Regarding report,to meeting is report to for discuss was the,Primary
Regarding price,in the price so discount is on,Promotions
Regarding office,be team will discuss office this was for for,Primary
Regarding clearance,discount but are clearance and the bargain that,Promotions
Regarding bargain,of in clearance bargain so and was discount,Promotions
Regarding settings,that so will in settings update and the,Updates
Regarding offer,percent and save so that in is offer for is discuss for so,Promotions
Regarding verify,so login account for this verify on was for at but,Updates
Regarding cheap,verify terms or be this cheap of sale to the,Promotions
Regarding meetup,and dinner but meetup but will or is to or are hangout,Social
Regarding office,project that at of that offer is are this this office of,Primary
Regarding meetup,it be in at hangout meetup for friend be will,Social
Regarding login,for so of security login at or of verify hangout party so at and and,Updates
Regarding price,but on of will save cheap and price,Promotions
Regarding discuss,at be is that update on password presentation discuss but,Primary
Regarding password,for be was password the for to confirm will this of or login,Updates
Regarding deal,will sale are at are but deal that was,Promotions
Regarding discuss,the the for or discuss discuss percent but report at is of,Primary
Regarding friend,at was the and dinner friend and on in,Social
Regarding invite,on invite and will in was is for invite on that party it,Social
Regarding share,this share this hangout report so this this was meetup to,Social
Regarding password,on but and on in password to of be will confirm,Updates
Regarding meeting,meeting was that at for report it,Primary
Regarding dinner,meetup to to be to friend the to it dinner,Social
Regarding offer,for or of be offer save the but was the to,Promotions
Regarding cheap,but are or deal cheap this this that will,Promotions
Regarding invite,but and invite for invite the the,Social
Regarding friend,video meetup in are is was for friend be that,Social
Regarding schedule,the schedule in the to that team for at,Primary
Regarding policy,be policy will on on password policy was it of,Updates
Regarding bargain,so bargain that to will price cheap at,Promotions
Regarding invite,share the to invite family will to be but was,Social
Regarding verify,are is the login that for of verify will the it,Updates
Regarding dinner,for so was that this friend and dinner was this,Social
Regarding video,will it video on for on in hangout,Social
Regarding deadline,it at or invite invite deadline of office team the are that,Primary
Regarding account,on but was at was of was will account but are security,Updates
Regarding deadline,report it update deadline was of are at security the project,Primary
Regarding discount,clearance in are discount but at discount to,Promotions
Regarding team,the at this to but and team for or be office but office,Primary
Regarding schedule,in in but it schedule meeting on so at,Primary
Regarding dinner,in party was at that share it so it are dinner,Social
Regarding deadline,are was so deadline agenda that the or,Primary
Regarding team,will team for presentation will or to was and,Primary
Regarding photo,settings will so photo login dinner will for and and,Social
Regarding terms,are update are account terms but or it to the it,Updates
Regarding discuss,at in is or discuss or to of and and is office,Primary
Regarding sale,will and clearance or the in sale and,Promotions
Regarding dinner,for the dinner at this on this friend to photo the,Social
Regarding password,and at so to login be password will account the and,Updates
Regarding security,security in and to of terms it verify bargain,Updates
Regarding price,it this at it cheap on to but price but,Promotions
Regarding deal,the this percent in deal are that for offer,Promotions
Regarding dinner,are the is dinner at this and is party of,Social
Regarding office,to is of office so for to cheap discuss clearance,Primary
Regarding dinner,the are video share the dinner the presentation in discuss,Social
Regarding hangout,hangout photo or to this in the the that for,Social
Regarding dinner,are be to this meetup so dinner share so,Social
Regarding verify,verify for was or login security of that and in,Updates
Regarding deal,to be so that party deal meetup is bargain and of,Promotions
Regarding report,policy of be but report in on agenda is will office,Primary
Regarding meeting,meeting it was will office for and be,Primary
Regarding project,are so and project are to at is deadline and of,Primary
Regarding bargain,it of was percent bargain for it and be of,Promotions
Regarding bargain,report and bargain at it clearance are sale but it,Promotions
Regarding meetup,meetup share be is that to at of,Social
Regarding discuss,to password agenda the in for but at it discuss project,Primary
Regarding office,is was project on office or are it on,Primary
Regarding terms,that of it will was policy be and will on terms,Updates
Regarding security,security that on or are will so was login in so was,Updates
Regarding price,will of that it price so and cheap of so discount,Promotions
Regarding hangout,dinner it be on the and it party but for hangout,Social
Regarding cheap,percent and this that but of percent cheap it is,Promotions
Regarding party,or party but party so in this video but are the,Social
Regarding agenda,agenda that meeting and and the or will meeting so,Primary
Regarding password,password be in be verify in but in,Updates
Regarding discount,percent discount and to that this the so for,Promotions
Regarding invite,to video for invite are at friend is,Social
Regarding family,is are family are will will friend,Social
Regarding deadline,and deadline to is and in will project that dinner,Primary
Regarding friend,but dinner it that invite this this at friend,Social
Regarding team,or to team and that team but,Primary
Regarding save,are it that save in save on the sale the of was,Promotions
Regarding video,is so video will in on but was friend,Social
Regarding settings,settings that settings the are are settings that,Updates
Regarding sale,of to this deal but was at will and sale bargain and,Promotions
Regarding account,account but to be this in to that it of the update,Updates
Regarding video,to the meetup it video hangout on be policy will so was,Social
Regarding office,and agenda on be office of of that meeting will the,Primary
Regarding settings,at settings meetup verify and at hangout was settings but it in,Updates
Regarding verify,for in verify is or terms password to,Updates
Regarding discount,this be but of or and this clearance discount,Promotions
Regarding confirm,to was is policy login be confirm in offer was it,Updates
Regarding deal,clearance it is to will are be deal the in,Promotions
Regarding meeting,so that is meeting the office was,Primary
Regarding verify,that or was login verify and password on,Updates
Regarding agenda,was on to to deadline this and to agenda this,Primary
Regarding discount,be invite is this party this discount discount the are clearance is be or,Promotions
Regarding project,are and and and deadline presentation so this to but this project and,Primary
Regarding meetup,or share this family of this meetup and,Social
Regarding offer,offer this so percent will it in in and,Promotions
Regarding photo,photo family so it it to terms for policy be this,Social
Regarding clearance,for and for are price discount it so of at clearance,Promotions
Regarding login,will it login to cheap is or it confirm,Updates
Regarding verify,security but the verify be for in it will it to,Updates
Regarding discuss,presentation to and but to are discuss but or,Primary
Regarding discount,discount is at bargain will so so are discount in is,Promotions
Regarding discuss,and for to schedule at discuss so is are in,Primary
Regarding project,at but to that discuss be be project to but or,Primary
Regarding dinner,it of of dinner the is but the dinner,Social
Regarding verify,will it was at it on account are verify that,Updates
Regarding terms,be are is was at terms this at it to be security policy,Updates
Regarding presentation,to deadline presentation for the agenda but this and it,Primary
Regarding deal,on percent deal this to sale be this for at the and so,Promotions
Regarding deal,it deal price this was it this so and,Promotions
Regarding team,discuss are team of team of will to,Primary
Regarding agenda,that it meeting agenda will or so team of for,Primary
Regarding photo,on share on is photo be photo but in to team the the,Social
Regarding team,deadline at at discuss is will of it this team is are,Primary
Regarding photo,was party this party will this of so of photo for,Social
Regarding meetup,family and family meetup at be of will and was,Social
Regarding deadline,be to agenda to deadline the is or for be and,Primary
Regarding meetup,of the meetup is that meetup the,Social
Regarding price,in of the it that it this price price was,Promotions
Regarding security,on that password so the for or this in this security but,Updates
Regarding login,but login to on will verify that account to the,Updates
Regarding offer,are or offer report it and was sale of for this be was,Promotions
Regarding clearance,it of will are but at but it clearance in save sale,Promotions
Regarding account,this account in and and to it cheap is security on sale are was update,Updates
Regarding photo,at the will was photo hangout are will family,Social
Regarding report,on will in verify and policy or team for or report,Primary
Regarding clearance,or will be cheap it sale at be that agenda office for clearance,Promotions
Regarding team,but will be team was so to office was,Primary
Regarding friend,be that invite that friend will for this the be friend will,Social
Regarding report,discuss are report on was are this is project for or that of,Primary
Regarding terms,for for are password confirm terms it and,Updates
Regarding deal,video that deal clearance for for will of,Promotions
Regarding settings,it settings will for update update be will this on to of,Updates
Regarding password,to to this be of is settings and was password at of deal,Updates
Regarding friend,to for is are this friend share will so this the dinner,Social
Regarding account,it be of on account verify be be to was will,Updates
Regarding update,update was is is it that and to the security is the,Updates
Regarding discount,in cheap or that on share be in share discount is are it at,Promotions
Regarding deal,in but percent deal for so to,Promotions
Regarding login,login are for so for so at account,Updates
Regarding offer,but was was sale to is was cheap of offer,Promotions
Regarding policy,at login so on but will be account or video policy,Updates
Regarding presentation,are for it be on presentation that be so deadline be,Primary
Regarding family,family was of but at are invite for,Social
Regarding terms,are it update be in to for so terms be,Updates
Regarding share,photo so that share was for in hangout and in,Social
Regarding deadline,friend deadline in will of to presentation for,Primary
Regarding sale,but cheap or this sale the and will that is,Promotions
Regarding deadline,of deadline the this are project to,Primary
Regarding security,security this the will account terms or that,Updates
Regarding hangout,will this be will it it video for be hangout and in,Social
Regarding family,family the party be be party of or at are be,Social
Regarding schedule,at schedule is to was in are office so to will login,Primary
Regarding share,this hangout discuss this share or be team video or,Social
Regarding video,was that so to hangout this video family,Social
Regarding save,in so to save this at save but that will,Promotions
Regarding agenda,office agenda on be the for it save on cheap,Primary
Regarding presentation,so was and at discuss on presentation and be,Primary
Regarding meetup,is to meetup share this is that this at for,Social
Regarding deadline,at is team will are will this are deadline on be,Primary
Regarding hangout,photo it this was hangout will for to that at the,Social
Regarding office,security on agenda of for was for on for that office be this,Primary
Regarding invite,to invite but so was it share,Social
Regarding deal,is of it and at of deal or deal was,Promotions
Regarding discuss,for discuss of deadline but was of deadline on so in,Primary
Regarding offer,of of to will but on for cheap to offer to,Promotions
Regarding hangout,family so at was hangout meetup but that,Social
Regarding confirm,for the confirm this that will of that terms of it,Updates
Regarding share,the at invite or this and is are share it will,Social
Regarding terms,this for so this verify or is and it that terms on confirm,Updates
Regarding discuss,discuss at so but for in at are is presentation presentation to and,Primary
Regarding deal,will will at clearance for on was deal it on,Promotions
Regarding clearance,was or so bargain clearance to clearance was of or or was on,Promotions
Regarding clearance,percent offer of clearance is that in in on but at,Promotions
Regarding schedule,the are that schedule project is this this is,Primary
Regarding friend,in so friend in this invite to it was for of,Social
Regarding discount,discount but and but be and in or discount,Promotions
Regarding bargain,to so bargain will offer is or be are,Promotions
Regarding settings,be on on schedule settings security will but be and or presentation,Updates
Regarding save,save are for will it on the that policy but for cheap policy at,Promotions
Regarding cheap,this on this the of price cheap on,Promotions
Regarding price,on that so price bargain but is save is to is,Promotions
Regarding account,in the settings or in but verify account,Updates
Regarding settings,settings confirm that this it be of are,Updates
Regarding password,to for in it password account is on are are,Updates
Regarding discount,is of or percent to for is discount will in will this,Promotions
Regarding dinner,the of of this video at dinner on this are party,Social
Regarding settings,account or it for share was of is settings confirm so be on,Updates
Regarding confirm,to it and for be confirm login,Updates
Regarding security,that so is security but that is security be,Updates
Regarding update,confirm this in the confirm for in update it,Updates
Regarding account,will settings for but account but are in so,Updates
Regarding hangout,so it in be and the hangout was party hangout,Social
Regarding invite,at will or at meetup and invite it for this,Social
Regarding bargain,for on office cheap this bargain will so that to and and agenda this,Promotions
Regarding photo,but photo it so that or is is cheap party for,Social
Regarding invite,this invite of invite the is are,Social
Regarding agenda,to and or team or to agenda in that on will is,Primary
Regarding report,meeting on video photo this so that on discuss are report,Primary
Regarding discuss,office in presentation but and and and update discuss account,Primary
Regarding photo,the photo is will dinner is and friend,Social
Regarding save,and it to save for is or on of be bargain that,Promotions
Regarding percent,was will to percent discount be on so it for discount for this,Promotions
Regarding confirm,schedule of are the so this schedule confirm and password to,Updates
Regarding policy,to security this to of policy for the that be or,Updates
Regarding discount,it be to the be discount clearance deal,Promotions
Regarding price,or this price is will to be clearance that,Promotions
Regarding percent,of for of to that clearance percent clearance or,Promotions
Regarding team,on in discount presentation this was team bargain at of or,Primary
Regarding security,in will will was this login security,Updates
Regarding party,to that to family or or family this to party,Social
Regarding dinner,is at in dinner are photo of,Social
Regarding sale,are sale confirm is of will sale the and price this but password,Promotions
Regarding presentation,but to will team and for presentation be and,Primary
Regarding terms,so login or the this terms was project this security was presentation,Updates
Regarding deal,but it offer or in but the deal this so and be,Promotions
Regarding dinner,dinner at that to it invite to it family will,Social
Regarding discuss,to and for this for team but discuss it of it,Primary
Regarding party,and of family party be will for,Social
Regarding policy,it settings is is for team it be policy security,Updates
Regarding meetup,on dinner report be or office on to be is for meetup,Social
Regarding save,it of was save it so and this but the for deal offer,Promotions
Regarding hangout,it hangout in on at at hangout at that of was that,Social
Regarding sale,percent this the to the clearance of sale are be and is,Promotions
Regarding login,to login but or but in be this login of,Updates
Regarding account,the or to or so in and account policy that so,Updates
Regarding invite,this was photo of photo are is but invite this was,Social
Regarding report,report was and report bargain report this to this for at,Primary
Regarding save,to percent for be the this is of discount save,Promotions
Regarding percent,bargain percent on that to was in so this hangout dinner be it to,Promotions
Regarding offer,of at of save offer but be percent at and of is,Promotions
Regarding bargain,at it be bargain or this save sale will are are in,Promotions
Regarding office,to so team at to is schedule the office,Primary
Regarding video,or and so that be was video video at,Social
Regarding update,login update so at that this but it is or,Updates
Regarding share,be in in party is are but share hangout that it was,Social
Regarding family,in on at be family was so family but this so so,Social
Regarding policy,the the for account policy so on on,Updates
Regarding family,on this to on is the video video so family and the,Social
Regarding office,in or be are but office schedule that office,Primary
Regarding confirm,that on for that to and login confirm,Updates
Regarding share,of it party it share so but be to,Social
Regarding presentation,of the will discuss team policy presentation at this at this,Primary
Regarding sale,but of or that that but clearance meetup in be sale,Promotions
Regarding update,will security update to settings the is of,Updates
Regarding dinner,on dinner to share that was it be family for and,Social
Regarding share,share will so in photo for it,Social
Regarding deadline,so are and are presentation on security so that be be deadline,Primary
Regarding sale,at sale to was and of on sale it are on sale,Promotions
Regarding deadline,discuss be agenda at deadline of to so in are,Primary
Regarding presentation,the but but on be the agenda presentation are was,Primary
Regarding deadline,in be meeting this the are at deadline be team,Primary
Regarding settings,or to update settings to be in of and to is it,Updates
Regarding meeting,invite was report meeting so or presentation be or in,Primary
Regarding discount,clearance are is discount the discount for at on,Promotions
Regarding settings,will was or settings security this at,Updates
Regarding verify,but and it or of verify are verify of,Updates
Regarding friend,in this for are dinner but and are and friend of,Social
Regarding project,office for was is are project is of are the at discuss,Primary
Regarding share,in friend it in share at share but,Social
Regarding schedule,report and was that the be schedule be was,Primary
Regarding schedule,schedule and so is the that or the of it that agenda,Primary
Regarding party,so is or are but to it will hangout or party confirm that,Social
Regarding party,was this family invite that this was party,Social
Regarding discount,at at so in discount and sale at,Promotions
Regarding discuss,are was discuss that discuss is but in,Primary
Regarding bargain,offer bargain deal it be at that is of,Promotions
Regarding meetup,was on in that be of meetup so that on meetup so dinner,Social
Regarding settings,will but password at and settings but,Updates
Regarding deadline,presentation are deadline office so the and for is so are,Primary
Regarding meetup,but be of meetup be and for video in photo,Social
Regarding presentation,in for be are at report of this presentation and be,Primary
Regarding cheap,on or the cheap is cheap this share that the was be or,Promotions
Regarding policy,party policy are verify be it for at password in are that this this,Updates
Regarding friend,and is but family friend was the sale meetup,Social
Regarding security,report and the password it policy security will in this to are this schedule,Updates
Regarding discount,for discount in clearance or of on on was the are will save,Promotions
Regarding discount,are clearance at verify sale so the verify discount is,Promotions
Regarding policy,account but so policy but the the for in are on in security,Updates
Regarding sale,of was on this but clearance this and sale but to deadline to,Promotions
Regarding friend,that be be was family friend to,Social
Regarding verify,at the this verify the confirm for,Updates
Regarding video,so it offer but and video and for photo for,Social
Regarding save,be it save or of or price sale is on that the,Promotions
Regarding confirm,at it confirm this password in at of,Updates
Regarding settings,it and settings account at so for party update,Updates
Regarding project,are discuss be for discuss so project was on to,Primary
Regarding security,to and password security of this to login to,Updates
Regarding hangout,it be deal are is hangout but sale hangout on so the for share,Social
Regarding presentation,office and settings confirm in will it but at the presentation,Primary
Regarding confirm,policy and is are be on confirm on but that password and,Updates
Regarding sale,deal and on sale will is in offer or and or was to,Promotions
Regarding settings,for of on that it terms is at settings are,Updates
Regarding office,be this is in it but office agenda,Primary
Regarding project,on that will the but but project team or are,Primary
Regarding party,photo are but at the that will party,Social
