subject,body,category
Regarding project,was on that or be the that in it project project or,Primary
Regarding share,photo on it will is that party so share at be,Social
Regarding confirm,at or will or this that it was will that password confirm,Updates
Regarding cheap,be are and cheap so that it percent it percent will be so,Promotions
Regarding security,be verify was on or login and security be will to,Updates
Regarding report,report on this at be is and so in sale schedule office will so deal,Primary
Regarding confirm,on was that the confirm but policy that and this or policy,Updates
Regarding login,are of and and of this password of login,Updates
Regarding deadline,be is of deadline that report discuss was,Primary
Regarding update,the that the are confirm update will so,Updates
Regarding offer,of is so deal offer that is,Promotions
Regarding offer,for bargain this office is will discuss on offer to sale for that,Promotions
Regarding terms,but office so will that on terms password is team so on is verify,Updates
Regarding project,so this project will are presentation it that,Primary
Regarding team,will team meeting was for deadline for are,Primary
Regarding project,at will discuss project and at this for,Primary
Regarding report,report on presentation are the to or,Primary
Regarding confirm,will is for or or and are that so account confirm update,Updates
Regarding video,share or that was for so video at or the was,Social
Regarding project,so the of deadline was is will project on it,Primary
Regarding deadline,and it team and deadline is to for it is,Primary
Regarding confirm,confirm to to are for for verify in,Updates
Regarding sale,the be but security cheap percent sale it but but,Promotions
Regarding meeting,this at and project meeting are or are it so in on,Primary
Regarding friend,at family of for but but was friend,Social
Regarding bargain,this that so offer price the bargain the was it,Promotions
Regarding save,save it are offer and will that percent on was at be,Promotions
Regarding meetup,meetup it will meetup but the in the the,Social
Regarding deadline,this for deadline so report will the at on that this,Primary
Regarding cheap,it the for for on be but cheap offer be will cheap,Promotions
Regarding share,or share in update meetup photo so update was or,Social
Regarding team,team in the report this is and,Primary
Regarding report,but this on in it schedule at presentation report,Primary
Regarding share,friend of meetup is this the be so share,Social
Regarding confirm,to at was at but office it confirm account in security,Updates
Regarding bargain,offer bargain was it will that for this it in of,Promotions
Regarding hangout,so at be hangout are in is and was are friend,Social
Regarding meeting,meeting that in or schedule on for that so for at discuss on,Primary
Regarding cheap,will in this to in cheap was the save this on,Promotions
Regarding password,and but terms be password be but,Updates
Regarding invite,or invite dinner be this this for meetup to of that,Social
Regarding friend,to this login friend video and it of on password this the of,Social
Regarding sale,in to for sale so or offer the,Promotions
Regarding family,that on to is friend this family at of was,Social
Regarding meeting,so will so be meetup but agenda was meeting of this so but,Primary
Regarding party,is is be party on but dinner and,Social
Regarding offer,percent in are and was but offer or and and so,Promotions
Regarding office,be is office on to report of it to this office be is,Primary
Regarding clearance,it clearance on and was cheap policy was the be clearance settings this or,Promotions
Regarding share,so share in dinner friend it of but and are,Social
Regarding dinner,but so is and are photo dinner was,Social
Regarding save,this it of save cheap it the,Promotions
Regarding report,at that are is in discuss report the be on,Primary
Regarding agenda,this of the presentation but are meeting was is agenda,Primary
Regarding discount,for at be but be so discount discount,Promotions
Regarding share,party share is in is it share is,Social
Regarding discount,of will discount cheap at and it and but it,Promotions
Regarding confirm,at verify was this confirm in the this be so so it,Updates
Regarding report,it discuss are it report is but,Primary
Regarding login,meetup confirm for for so login at are so so so,Updates
Regarding verify,verify it or on but so was terms verify in,Updates
Regarding schedule,this schedule presentation on but account team for are will this so are at confirm,Primary
Regarding cheap,in that for cheap this deadline cheap office is will,Promotions
Regarding party,in for of party at is party party,Social
Regarding security,are was account be this security this bargain or for of sale it that,Updates
Regarding project,will but team that project presentation are but is,Primary
Regarding clearance,be for it of the clearance of clearance are so but,Promotions
Regarding deal,be and in deal this this for offer,Promotions
Regarding friend,but family friend at but family it is this this,Social
Regarding presentation,agenda at will so to be for presentation to will is,Primary
Regarding video,of video for and but in it share of,Social
Regarding share,the be will share video is photo and or is,Social
Regarding security,update was that security is on the on deal the is or settings on,Updates
Regarding party,that video is and for it was invite in party or of,Social
Regarding deadline,discuss deadline are this are but be are schedule in was,Primary
Regarding video,but dinner to and video on to on share,Social
Regarding deadline,to the for or that discount will or deadline this deadline was,Primary
Regarding update,are and and the at confirm update login,Updates
Regarding report,bargain this at report for so sale discuss this will,Primary
Regarding share,it or share was on so this share invite to will so,Social
Regarding settings,confirm settings it or this but update in,Updates
Regarding account,will on it password that of account,Updates
Regarding video,in in but is video in or or at party in it,Social
Regarding project,team project on is will of this discount or it the is it,Primary
Regarding meetup,are this hangout meetup are or is video that on or this in,Social
Regarding invite,hangout are or or but at terms it that to to or meetup invite,Social
Regarding settings,the that this team settings schedule be password it for was login,Updates
Regarding price,or it on discount or the price,Promotions
Regarding meeting,at so report to but meeting meetup it on,Primary
Regarding verify,for presentation will login in or was are verify,Updates
Regarding verify,but in update to in is and verify to share confirm,Updates
Regarding share,to and share but of that friend the dinner was in and,Social
Regarding account,in so will confirm be account that terms,Updates
Regarding office,presentation are to is for at or to at that office are,Primary
Regarding clearance,at in is at that this for clearance percent,Promotions
Regarding price,are to price at hangout be be clearance save,Promotions
Regarding meeting,for and discuss will on at or this for meeting be deadline,Primary
Regarding terms,of update terms is that so so to the in that and,Updates
Regarding terms,settings or terms will this but at are account for but in,Updates
Regarding meetup,to will for or party it meetup on will the,Social
Regarding video,of at to save but are for cheap to friend this video,Social
Regarding policy,of in this policy so bargain and in it terms that the,Updates
Regarding discuss,dinner agenda will on of in for on discuss at,Primary
Regarding photo,are this are photo share was so,Social
Regarding share,are it of be dinner or be this share dinner,Social
Regarding share,it will be so that or hangout is is share or party,Social
Regarding meetup,meetup that and was for will the it on meetup,Social
Regarding password,will this password to will or or the settings,Updates
Regarding security,in and schedule is and verify was security on the verify,Updates
Regarding share,was party was was be of meetup are be this in are share,Social
Regarding price,cheap was it so discount it at price but,Promotions
Regarding verify,be settings be will settings be on verify,Updates
Regarding invite,or are invite security video it and was to or of are on,Social
Regarding report,report office project this is share will family and is,Primary
Regarding security,in of will are the this are settings security in,Updates
Regarding deal,deal save this and is this are,Promotions
Regarding family,at be on of for family invite at on this at but,Social
Regarding dinner,so it for to the at of family so dinner it so,Social
Regarding security,but security but this be of security are that,Updates
Regarding cheap,in to it cheap is will offer,Promotions
Regarding photo,video that photo is is the so so was,Social
Regarding verify,terms this verify that the was login or be,Updates
Regarding video,was video photo photo and this or will that was will,Social
Regarding office,that in presentation it and for project office for are,Primary
Regarding hangout,of hangout but that but it photo and but that of,Social
Regarding deal,is be deal in was office the and clearance it for it office,Promotions
Regarding share,this or share on invite will on was,Social
Regarding dinner,that be that are share dinner is it the are,Social
Regarding dinner,will was is was dinner in for to invite this was,Social
Regarding sale,this clearance of be at is the sale,Promotions
Regarding policy,was for in policy will update or on of confirm are of,Updates
Regarding settings,or at in settings to to or settings is,Updates
Regarding bargain,be so was save in bargain is of in and in,Promotions
Regarding invite,was was this are was so was for was video invite of,Social
Regarding percent,be the save the discount will percent on,Promotions
Regarding party,hangout in at was at be but party it in it,Social
Regarding settings,that settings of so or for settings,Updates
Regarding update,update and it will at security at,Updates
Regarding clearance,clearance or of are are and at in clearance clearance for that it,Promotions
Regarding bargain,price in bargain price or be or it are,Promotions
Regarding price,this this price cheap the or the on are so,Promotions
Regarding save,are or be this is that save or deal or clearance it,Promotions
Regarding discount,are that price discount is is the this this but so,Promotions
Regarding confirm,deadline are verify presentation the it this this confirm account,Updates
Regarding meetup,meetup at but share is and this photo,Social
Regarding hangout,friend to will for hangout but was,Social
Regarding team,agenda the the team it the office in,Primary
Regarding cheap,on the and in in cheap at bargain of that,Promotions
Regarding share,office be on are this and party be is share to share for that,Social
Regarding percent,be it in are so are percent or cheap,Promotions
Regarding account,or and it update to are are and at account in this,Updates
Regarding password,to to at password it for it policy password are that of for,Updates
Regarding bargain,save bargain for but are this it,Promotions
Regarding bargain,this this price bargain it offer and are,Promotions
Regarding meetup,share meetup so will share at at or of for but be,Social
Regarding percent,of deal percent it the price are to the will,Promotions
Regarding clearance,it or for bargain the the clearance discount,Promotions
Regarding presentation,but to project is bargain will to to report to was presentation that,Primary
Regarding update,the update was so for or on security at be,Updates
Regarding share,at it it and this share meetup to to hangout on at,Social
Regarding sale,offer it in and sale are be deal,Promotions
Regarding percent,to this in percent at that that on cheap so or it,Promotions
Regarding project,be will of is that is that project project for,Primary
Regarding confirm,but security and confirm verify so of this on and be,Updates
Regarding invite,dinner was to are of so invite for or,Social
Regarding price,the will on bargain sale or price are,Promotions
Regarding report,on presentation office report or at was is be be,Primary
Regarding report,for that report will that to that but team but in,Primary
Regarding bargain,bargain is to at bargain this at are this percent this will,Promotions
Regarding team,at team team or at to to it office it will,Primary
Regarding terms,on in update on or it terms on is,Updates
Regarding settings,on it is be settings login and login but,Updates
Regarding bargain,be in sale price this on bargain but of,Promotions
Regarding password,the this or will but and the it login password this so,Updates
Regarding dinner,video family in so but the on so dinner,Social
Regarding policy,confirm the video at at in the are the policy verify is,Updates
Regarding cheap,that it percent on discount at at this be cheap,Promotions
Regarding price,is this schedule are to to save clearance discuss the is and price and,Promotions
Regarding meetup,to to the party family of this the in meetup will be,Social
Regarding offer,will at and to update cheap to offer discount,Promotions
Regarding dinner,that to the in settings that be invite is in dinner policy or,Social
Regarding update,update but the at in for is security are is for are,Updates
Regarding friend,will confirm video in invite is of friend was was will but,Social
Regarding photo,on and photo was party so photo was it for so this at report,Social
Regarding update,policy update in that the in for of update so be at of,Updates
Regarding price,so on price but price that on in will,Promotions
Regarding hangout,meetup hangout the will in be was so it in is,Social
Regarding invite,be to or meetup login is security that party be but are for invite,Social
Regarding update,settings was that in will update the but,Updates
Regarding password,it is the terms update but password so the,Updates
Regarding account,will the to to to are account at be security at and,Updates
Regarding clearance,this that of clearance to percent bargain for to the be,Promotions
Regarding confirm,update photo be confirm the be is will or are at was update,Updates
Regarding report,deadline it at to report is offer will it,Primary
Regarding deal,for of this or in of deal in price to,Promotions
Regarding password,is account and this this and so was but and password that verify,Updates
Regarding price,are the this it the is discount price and in of on,Promotions
Regarding office,discuss at cheap that in for sale are will office of for for,Primary
Regarding schedule,schedule agenda of this it so at so or,Primary
Regarding presentation,but but to deadline of but presentation,Primary
Regarding meeting,are be of meeting so team at be will be will so,Primary
Regarding login,to meeting to so login and in project that settings the or terms,Updates
Regarding video,at dinner and be party on video is,Social
Regarding discuss,so the in of percent will was and discount meeting discuss project of,Primary
Regarding agenda,office and to or agenda be are so agenda and,Primary
Regarding account,it of the account the that confirm that,Updates
Regarding update,at are on login be of in update the,Updates
Regarding offer,be and offer be for this but is and offer bargain,Promotions
Regarding login,was login account but the be and terms in on,Updates
Regarding account,account this was of was security in will,Updates
Regarding schedule,is the are of or at discuss is and schedule presentation,Primary
Regarding deal,of settings that the or deal deal save of at was is,Promotions
Regarding video,on that photo will video is for at friend it but the and,Social
Regarding account,to to but in meetup terms be be account video,Updates
Regarding project,will it in project for was so office it but in of,Primary
Regarding dinner,it will the dinner it so the so the dinner invite,Social
Regarding terms,policy and terms the of that the it it terms was,Updates
Regarding project,the the project will or are agenda presentation,Primary
Regarding team,and team but or team is and at at and or,Primary
Regarding sale,sale are was was this on is sale,Promotions
Regarding report,is this are report this or meeting agenda,Primary
Regarding clearance,be cheap was discount for clearance this be will is was was,Promotions
Regarding verify,login that but at or verify password so,Updates
Regarding report,of will discuss is or bargain report to of cheap,Primary
Regarding confirm,in so but to account verify will to was the this this confirm,Updates
Regarding settings,will settings or the or and at update to and be terms that,Updates
Regarding discount,offer deal that the on the but on discount is the,Promotions
Regarding account,password it or of is but but it account is so login,Updates
Regarding team,this so to team or at of agenda or that of,Primary
Regarding cheap,for on this deal this on cheap is to,Promotions
Regarding dinner,on that that of is party was the and video dinner,Social
Regarding password,was or or be at settings on or terms password was,Updates
Regarding update,verify confirm to or or it update are,Updates
Regarding update,be are to the it password at update and to was that update,Updates
Regarding friend,meetup terms but friend for are this friend or so to in so but,Social
Regarding password,it confirm password but policy to but so offer for,Updates
Regarding discuss,or and this discuss in schedule of team,Primary
Regarding hangout,or be to clearance so is it it that clearance is and hangout hangout,Social
Regarding meetup,friend the and or was share meetup for,Social
Regarding friend,that in be photo to but in friend of dinner are was,Social
Regarding policy,for policy is of on that was update login,Updates
Regarding deal,discount price at to deal of and and on,Promotions
Regarding deal,cheap was the it be deal be for cheap so this,Promotions
Regarding bargain,was so clearance or will on bargain will,Promotions
Regarding party,photo or invite but schedule it party and that or at,Social
Regarding settings,on for but it settings to policy so login,Updates
Regarding account,be it are or to for login account or and,Updates
Regarding share,that share for but share on it be for the,Social
Regarding discuss,be this this so but was project discuss the be the,Primary
Regarding team,or on agenda be so and to are team this this will,Primary
Regarding family,share that family for at on but,Social
Regarding agenda,save the discuss on agenda this at be,Primary
Regarding friend,the for meetup friend at be party in are the are are this,Social
Regarding password,was was of was password and and this is confirm it,Updates
Regarding account,or but password are account to in hangout for are hangout this are will,Updates
Regarding video,save of of that but will meetup video meetup will be,Social
Regarding discount,and is deal be is are but for discount bargain of,Promotions
Regarding deadline,deadline for so report and or so,Primary
Regarding friend,of of family are at this friend is and that is dinner at,Social
Regarding price,it price cheap or but clearance that was that this on be will,Promotions
Regarding share,share and at that this of the will meetup but,Social
Regarding hangout,but was video on at hangout be of friend at that the so,Social
Regarding offer,will sale and it on and on offer so was,Promotions
Regarding bargain,or be offer bargain is be this,Promotions
Regarding login,in at settings this is that is login it,Updates
Regarding clearance,are so the that for offer this clearance for it,Promotions
Regarding schedule,for was schedule is this but the so verify are is and team deadline,Primary
Regarding deal,it it to save in and this deal save of will so the,Promotions
Regarding project,project on in at that that office video it that hangout,Primary
Regarding schedule,was but schedule discuss so be be at on in,Primary
Regarding bargain,in it for deal or be clearance bargain,Promotions
Regarding confirm,but presentation confirm will terms be in on meeting be so of,Updates
Regarding offer,offer on in this discount this in be the it,Promotions
Regarding account,account policy this dinner in for so be at was but will are,Updates
Regarding confirm,so be hangout it or to confirm confirm,Updates
Regarding save,policy that was to the will save on on terms but it in save,Promotions
Regarding schedule,presentation or password or is schedule so to was,Primary
Regarding meeting,are was and presentation at meeting hangout or in discuss family of this,Primary
Regarding presentation,project verify for terms are office but so presentation but,Primary
Regarding discount,save percent and and discount of was but it is,Promotions
Regarding party,party on or is will video in for,Social
Regarding report,was this report is schedule was that was,Primary
Regarding presentation,presentation it save to will it project on is schedule percent,Primary
Regarding verify,will the or on account on the on are verify is,Updates
Regarding share,or on on will this invite to to share,Social
Regarding terms,policy this or or at of be it terms but it it,Updates
Regarding account,account at are login so on will,Updates
Regarding team,on or for report report will team on be in are,Primary
Regarding security,and or this be this be was at account security but,Updates
Regarding video,share so in are at video in in,Social
Regarding clearance,offer and so clearance for are be are this will so,Promotions
Regarding schedule,it so to so will schedule so but be deadline that schedule in,Primary
Regarding save,be this it price be the save will,Promotions
Regarding terms,to confirm it terms is verify presentation be was it,Updates
Regarding percent,but for percent was but cheap on is,Promotions
Regarding meetup,party this this it at it to and in at meetup the,Social
Regarding confirm,but confirm update the was in that are that of so,Updates
Regarding policy,settings policy this to this to settings to that on,Updates
Regarding confirm,are the login confirm at confirm to to,Updates
Regarding deadline,was was is team deadline report but it,Primary
Regarding percent,be or was is and offer it offer percent so or,Promotions
Regarding party,in video was will at meetup for party,Social
Regarding discount,discount to cheap this be photo in be was save is this or are,Promotions
Regarding update,are is that is of update verify this to,Updates
Regarding office,for at and it but office is be team that meeting and of,Primary
Regarding deal,was is that clearance to or price on that it deal,Promotions
Regarding share,invite are the share to are on,Social
Regarding hangout,this but the that in but invite hangout,Social
Regarding meeting,will that on it terms is on be team is meeting was to verify,Primary
Regarding cheap,the in be be was at percent but in cheap,Promotions
Regarding friend,are for the that it friend for family on party,Social
Regarding party,or party are at video this to the for party,Social
Regarding password,password to for are this and account this,Updates
Regarding save,was be deal that but that are percent in this save at,Promotions
Regarding video,family was this at video for are be at at or,Social
Regarding hangout,for will of in it will hangout hangout so,Social
Regarding agenda,on on presentation was is agenda office so on are,Primary
Regarding update,will on for it was confirm update or,Updates
Regarding password,so to login password and to at,Updates
Regarding login,is and password but but are login that or,Updates
Regarding discount,of but team is discount deal the the but are,Promotions
Regarding sale,at sale be of so offer sale that or,Promotions
Regarding office,be was was that are office at the is meeting on presentation,Primary
Regarding family,that photo will family be that this is in for,Social
Regarding schedule,for for the the be office be or is schedule are,Primary
Regarding schedule,this it report will was schedule will at in and it,Primary
Regarding security,the settings video security is and or account video for,Updates
Regarding video,video meetup to was are this to of so that on in,Social
Regarding policy,but account policy it but to to the that to,Updates
Regarding schedule,presentation schedule in will presentation in for be that,Primary
Regarding friend,video that hangout and or are that the is friend,Social
Regarding dinner,was so for family family on that dinner but but of,Social
Regarding project,and meeting of was but to so but of project that,Primary
Regarding dinner,or for on this for for for video at on dinner friend,Social
Regarding terms,be it be terms on confirm in was it,Updates
Regarding settings,be on on settings account is so so at,Updates
Regarding terms,settings are it update of was terms in are,Updates
Regarding cheap,cheap on percent in that of this,Promotions
Regarding schedule,was for the team of schedule on are is to team,Primary
Regarding presentation,discuss presentation of is presentation is for the for,Primary
Regarding deadline,on but it schedule on and is at and meeting of or deadline,Primary
Regarding party,percent and are are this party of is this the party was,Social
Regarding schedule,schedule is or it in at are agenda are for,Primary
Regarding account,verify or the was verify or are account will,Updates
Regarding report,report for the or on deadline report for and,Primary
Regarding meeting,meeting was that deadline that be to,Primary
Regarding meetup,be will invite that meetup was share it that but security,Social
Regarding login,password in but login it that of in,Updates
