subject,body,category
Regarding account,in that at and login it or account verify,Updates
Regarding friend,of will or to the friend video the,Social
Regarding discount,so at to in discount sale of at or is but discount that,Promotions
Regarding discuss,but will office in discuss and discuss is the the was is,Primary
Regarding invite,or in discuss invite of family share of or so or be will,Social
Regarding discuss,it agenda be was in is is discuss,Primary
Regarding share,for to party share will in at verify of that it it in,Social
Regarding price,so of and so and this price on discount price,Promotions
Regarding login,login the settings or to verify or in for so or the,Updates
Regarding meetup,this hangout be meetup be it are,Social
Regarding party,to this that of was so be for that party the update photo account,Social
Regarding meetup,meetup so that so party to was was or but,Social
Regarding presentation,at in on presentation of that to was for presentation on,Primary
Regarding project,project was at deadline this in to be,Primary
Regarding offer,offer on of for and be will or clearance on is,Promotions
Regarding terms,terms this are but for that be account this but account is this,Updates
Regarding team,at to or it meeting meeting team was are that in of,Primary
Regarding party,was party for was that and video are or and at for,Social
Regarding account,will in account account be at it for that,Updates
Regarding family,invite this be family dinner at in that,Social
Regarding team,but that on at the cheap team team the presentation,Primary
Regarding meeting,this team was is the for in for and but meeting,Primary
Regarding sale,but will that was of was so price sale was discount and,Promotions
Regarding presentation,presentation are for presentation the but the password report,Primary
Regarding sale,or bargain sale was on on of of,Promotions
Regarding percent,this are of of to be is percent price for cheap,Promotions
Regarding verify,to the it to confirm are to verify be or is was,Updates
Regarding party,meetup are will is to are are party bargain for so the,Social
Regarding verify,will the and it verify at to on account at of,Updates
Regarding terms,are for is terms verify and update be the,Updates
Regarding meeting,of meeting are on will report is this,Primary
Regarding invite,meetup this on in the to this invite be and of,Social
Regarding terms,will and settings are on in are will terms that are,Updates
Regarding invite,was or invite it share is the hangout,Social
Regarding cheap,cheap will to price was clearance was was in,Promotions
Regarding hangout,are that that hangout be to dinner is of is,Social
Regarding share,are to was be family on on was share be be is,Social
Regarding settings,settings that account is are are it and for confirm,Updates
Regarding login,so will login to cheap for at so for login update it or,Updates
Regarding meetup,meetup was share for be the be dinner,Social
Regarding cheap,clearance was or cheap to and percent so is,Promotions
Regarding share,was friend is share discuss are is will hangout is it presentation,Social
Regarding bargain,bargain or but or to was cheap was deal,Promotions
Regarding team,to team of are it the was schedule was,Primary
Regarding discount,at on so discount are percent are offer that on,Promotions
Regarding deadline,office deadline of invite on and it that and discuss,Primary
Regarding login,login this but the account be it verify of so to was,Updates
Regarding security,for security are account login is the and be in,Updates
Regarding family,it will and is video family the or be and,Social
Regarding update,to but are the account that terms on update it to it,Updates
Regarding team,was in it that team but for at office,Primary
Regarding family,family this be and at will was presentation presentation dinner,Social
Regarding video,was this for is will of meetup that video,Social
Regarding save,save for the but will in to on it cheap,Promotions
Regarding settings,at is for so on be at for of update settings the,Updates
Regarding office,that to for and or for deadline it office will,Primary
Regarding settings,update that that for is settings so update this,Updates
Regarding report,on for report was this at in discuss so project,Primary
Regarding deadline,of deadline agenda and meeting but it but of was on will this,Primary
Regarding password,report the will settings it for password presentation but security but but,Updates
Regarding office,meeting on office was be on that of,Primary
Regarding share,hangout will is will it it share in family on was,Social
Regarding password,on for security password for in are will but it in,Updates
Regarding sale,be at and of it will save the this on sale this,Promotions
Regarding presentation,this it or the report this presentation deadline,Primary
Regarding terms,is are terms it the the to be this security on,Updates
Regarding account,it to in settings account is to of it login,Updates
Regarding friend,dinner friend party report the the the of or on was that,Social
Regarding discuss,will for discuss in be that to agenda invite on share,Primary
Regarding terms,deal but will was settings are or terms so to deal or was,Updates
Regarding video,be it discount bargain it meetup this are and will video but are,Social
Regarding deadline,meeting or deadline or to for or of in the for in,Primary
Regarding meetup,family at this meetup meetup be in it be it it,Social
Regarding clearance,clearance discuss that so it will of sale for,Promotions
Regarding password,is is are password for of in that be policy that,Updates
Regarding sale,the are will in that it clearance will or sale for,Promotions
Regarding save,bargain is or but on save on for offer and and,Promotions
Regarding save,or in save and or that sale will the and that,Promotions
Regarding friend,be party of so dinner at friend are,Social
Regarding discount,that or on is was so is the was save at discount percent,Promotions
Regarding login,to are on password for at this login the it so but,Updates
Regarding account,for on on account for policy for but are,Updates
Regarding project,project this but of project meeting this be,Primary
Regarding family,family it this on so invite is the,Social
Regarding deadline,will in in office schedule deadline the this be for,Primary
Regarding video,video at in this are but video and for are invite to,Social
Regarding schedule,be was schedule presentation was is is so,Primary
Regarding bargain,for of bargain of of so offer,Promotions
Regarding hangout,but it is is party and hangout video will so,Social
Regarding percent,in will is are it on percent sale cheap,Promotions
Regarding confirm,or settings verify and will this confirm and,Updates
Regarding dinner,be at for in family was to to or is it dinner share,Social
Regarding meetup,video the is meetup in so family or and is,Social
Regarding security,in security password to was of policy on,Updates
Regarding schedule,the the save agenda or is that but at this schedule in,Primary
Regarding terms,at in terms password are the login the be,Updates
Regarding agenda,be this office are was is agenda for but project this,Primary
Regarding percent,sale this so it in and it offer are percent will,Promotions
Regarding family,are are so friend the so in to to on friend and family,Social
Regarding verify,at to be is at at so it are login verify,Updates
Regarding deal,deal to was that of the was this cheap,Promotions
Regarding office,at that team office the on that meeting for of that or that,Primary
Regarding verify,password be it the for will verify is account that for was,Updates
Regarding offer,so offer to for is security price in for discount on in at was,Promotions
Regarding family,in so family it family to will this offer be party percent are at the,Social
Regarding report,of report so project on schedule discount at for it sale on this,Primary
Regarding meetup,for policy or confirm and it party was so or friend meetup,Social
Regarding terms,it was verify for terms that that be,Updates
Regarding hangout,hangout was to invite the or the,Social
Regarding verify,it for or that to be in for the update security verify are,Updates
Regarding login,verify this of login but at to was this,Updates
Regarding account,at is account the will verify of will for,Updates
Regarding bargain,discount that bargain so was it it is discount at so,Promotions
Regarding discuss,will be in schedule that on will on discuss is but,Primary
Regarding presentation,office or is this to so and be presentation schedule,Primary
Regarding offer,clearance offer it the it was in it,Promotions
Regarding team,and report it the team the it for be,Primary
Regarding share,it it this video at photo this share be,Social
Regarding save,for be save offer for sale but it be,Promotions
Regarding password,password and is in confirm confirm but and but at for of,Updates
Regarding confirm,or are or terms it of confirm of,Updates
Regarding deal,discount deal will this but and for are but this,Promotions
Regarding terms,so terms to on that the confirm this in,Updates
Regarding photo,at and at on meetup for are party photo that,Social
Regarding offer,offer sale was offer of be it for and so the,Promotions
Regarding meetup,but that at will or be share was meetup so but be,Social
Regarding login,offer on or but of confirm login but are deal that,Updates
Regarding agenda,clearance deadline but agenda and are or cheap team for it or,Primary
Regarding deadline,of deadline for deadline that it team at,Primary
Regarding schedule,so schedule to for will project for are video in that at but,Primary
Regarding report,so deadline are team this is of report in the account it it,Primary
Regarding bargain,on in the to price bargain it are bargain,Promotions
Regarding photo,and was so is was invite on but photo in,Social
Regarding deal,this deal for clearance for for clearance is this account are at,Promotions
Regarding meetup,meetup or of dinner in at on is but to are friend the,Social
Regarding account,is in and that confirm or account was password,Updates
Regarding schedule,of but so in share that was in schedule meeting meeting in,Primary
Regarding login,that on confirm was login it on on to password was,Updates
Regarding account,this the account was password on and update,Updates
Regarding discount,and it of the discount on on discount offer or,Promotions
Regarding dinner,in invite in dinner is it but that or at was photo so,Social
Regarding discuss,or or is is but that are discuss will of project deadline,Primary
Regarding bargain,offer sale in meetup the bargain in to is at in this,Promotions
Regarding price,discount are in at and settings was cheap this to price this to,Promotions
Regarding photo,so and share photo this but in for dinner in it this,Social
Regarding meetup,hangout this of meetup it are password party so this the that of this,Social
Regarding password,terms this be will so password that be,Updates
Regarding video,report and or so and video this photo and are it at invite or,Social
Regarding report,be meeting the for this was report or,Primary
Regarding report,so deadline report or on are in so deadline and,Primary
Regarding discount,for of and it of discount cheap or for was that,Promotions
Regarding report,report this will the terms report will report so settings so,Primary
Regarding password,the at is to was policy password update,Updates
Regarding bargain,this and but be of bargain but sale but at is in,Promotions
Regarding settings,terms at are are account so will settings,Updates
Regarding deal,was will at discount presentation will sale and office of that for deal be,Promotions
Regarding share,hangout share be are so video was on be price,Social
Regarding bargain,the is deal it it price this bargain and,Promotions
Regarding bargain,in the and bargain for deal in was so,Promotions
Regarding report,report that it deadline in price that is,Primary
Regarding percent,to it be sale percent bargain or of,Promotions
Regarding project,are policy so so security project team but of and or but agenda for,Primary
Regarding offer,this at offer on share cheap will this clearance will,Promotions
Regarding terms,but terms settings that at will was verify the,Updates
Regarding bargain,that this and it for or bargain for deal,Promotions
Regarding settings,is confirm at was and will settings terms this so,Updates
Regarding sale,offer and sale this this price to for,Promotions
Regarding share,but that share invite for that or,Social
Regarding bargain,save and offer of bargain or it at but,Promotions
Regarding cheap,at is bargain are on the is on be price cheap,Promotions
Regarding discount,for discount to for for or deal this,Promotions
Regarding price,to of it to deal is this price was in but that,Promotions
Regarding video,the video this so for of video but this are that,Social
Regarding sale,at offer of sale for be but,Promotions
Regarding discuss,discuss it so for is on be team,Primary
Regarding report,report are on report for so will,Primary
Regarding update,terms it of clearance in in security so update so of,Updates
Regarding schedule,or schedule it this in that to office of at but,Primary
Regarding price,in sale it report price report are and was and,Promotions
Regarding presentation,the to discuss and it presentation in,Primary
Regarding dinner,to so it will in password dinner so meetup was family are,Social
Regarding presentation,will and policy and to will is will schedule office presentation and,Primary
Regarding party,is party is in so the invite so photo will for for will,Social
Regarding sale,offer be at but sale will is,Promotions
Regarding password,in that so on are in for will are password update so,Updates
Regarding photo,photo at on so will of of or meetup dinner it,Social
Regarding sale,or sale the this it sale and be and that and the,Promotions
Regarding discuss,the that will for be or to discuss to the but report,Primary
Regarding policy,to at in settings it this terms are policy,Updates
Regarding schedule,deadline schedule save and will be this at to agenda,Primary
Regarding team,to on but meeting or are this team are,Primary
Regarding invite,to that at and invite the family of are is but,Social
Regarding report,be is report deadline and policy was at,Primary
Regarding family,project and in but to family in photo was family be deadline for in,Social
Regarding percent,are is on was is percent save this save is that,Promotions
Regarding discuss,office are is it or for but discuss this discuss are and,Primary
Regarding bargain,are and the to and for it at will bargain bargain at,Promotions
Regarding invite,be but invite is of this meetup that so this will video,Social
Regarding deal,on but percent the to it are and at deal clearance will so,Promotions
Regarding terms,on that terms in for are for policy on will be,Updates
Regarding login,was and be login was for login,Updates
Regarding project,be project the at office it on report,Primary
Regarding meeting,or the it on is at is report that meeting and so,Primary
Regarding presentation,be are be that it of was presentation office that will,Primary
Regarding agenda,of to is is but agenda project that,Primary
Regarding save,in of and at will deal update save at this and security be but sale,Promotions
Regarding project,will this the that presentation or so project of deadline,Primary
Regarding discount,is on it so discount is are will or will deal for,Promotions
Regarding offer,sale will percent are in in at offer,Promotions
Regarding video,share invite video to the at but it,Social
Regarding clearance,but clearance that for deal and offer so photo photo or,Promotions
Regarding office,office this to on but and for it discuss,Primary
Regarding confirm,is or will policy the will and the confirm is,Updates
Regarding cheap,on are save cheap or that be at be for that it,Promotions
Regarding login,to will it are so login login on are the,Updates
Regarding agenda,it schedule are agenda are is on it schedule that,Primary
Regarding verify,of is verify confirm be for so verify,Updates
Regarding clearance,are was on that clearance password or to clearance so was be is,Promotions
Regarding clearance,in for be clearance in offer of on but clearance the is,Promotions
Regarding offer,will discount for offer be are that are for,Promotions
Regarding login,it login so this settings to policy to of that for,Updates
Regarding office,are project will to presentation and office in this,Primary
Regarding password,password or and to this project to policy,Updates
Regarding invite,be that of so this this invite at that is invite was,Social
Regarding save,in be save offer save the was it at on,Promotions
Regarding cheap,deal is deal cheap it on at for be,Promotions
Regarding terms,this is terms account so will on confirm are on and of,Updates
Regarding settings,confirm settings but the it for settings it,Updates
Regarding security,it that this security so confirm but meeting,Updates
Regarding discuss,is be discuss for are that be schedule team in it be,Primary
Regarding schedule,schedule but presentation or it was of was discuss or,Primary
Regarding save,bargain percent is is of for on for at is save in,Promotions
Regarding schedule,meeting schedule is in in or to to are,Primary
Regarding price,photo save this friend price are or bargain will of,Promotions
Regarding account,of for account the will policy the or verify,Updates
Regarding discuss,are for and this the account schedule are discuss to of,Primary
Regarding bargain,bargain sale so is this at to but meetup is friend deal,Promotions
Regarding save,is that save of cheap it be of but terms,Promotions
Regarding sale,that so was at sale save on deal are is so,Promotions
Regarding discuss,office price will it or it for but the discuss,Primary
Regarding meetup,be on is are so this meetup photo family,Social
Regarding discount,discount that in are this on the so but bargain of deal,Promotions
Regarding presentation,so presentation are deadline the was of discuss to it but this to,Primary
Regarding deadline,at deadline of for are to at report,Primary
Regarding deadline,it for in deadline the on deadline the will it will discuss,Primary
Regarding confirm,to in so be confirm on security,Updates
Regarding video,but be photo so this video but video,Social
Regarding confirm,the security this that of is confirm update,Updates
Regarding agenda,agenda and discuss for this on the,Primary
Regarding schedule,discuss the the was be is be schedule cheap and,Primary
Regarding photo,hangout to family but is are it on was photo,Social
Regarding bargain,or to was it or percent the will bargain or at was,Promotions
Regarding party,this will or of that hangout update on update so party to are so,Social
Regarding policy,login policy in of but or account the and,Updates
Regarding party,it meetup it it the party or that the to of it hangout,Social
Regarding meetup,of in percent are meetup meetup be in hangout,Social
Regarding price,it be price that cheap but to or that share to,Promotions
Regarding terms,that be or so are that terms of terms account on but,Updates
Regarding deadline,so and so deadline but the to office,Primary
Regarding family,at but family on and family are,Social
Regarding price,was will at on price are cheap or,Promotions
Regarding deal,deal and to or save terms for is is are will are the,Promotions
Regarding cheap,on or so percent it clearance is on it will cheap or of,Promotions
Regarding update,settings it for discount was will was or update discount,Updates
Regarding team,the for is of team in this so project at so on,Primary
Regarding bargain,of sale on in bargain are and this but project,Promotions
Regarding security,in that the settings login at and that security,Updates
Regarding schedule,for agenda is this so schedule it but of the the,Primary
Regarding presentation,be to at presentation to schedule this,Primary
Regarding price,the discount for so price is are be will was but to,Promotions
Regarding save,is but bargain or was will was bargain the save for of are,Promotions
Regarding family,and to family this percent is but this it share,Social
Regarding offer,offer it or in are be at percent so,Promotions
Regarding meetup,it but to settings meetup of are confirm photo or so are,Social
Regarding dinner,be family it dinner invite on of it,Social
Regarding deadline,is so be presentation deadline of of is,Primary
Regarding report,but discuss it report so on it was,Primary
Regarding confirm,confirm it verify will but in or this is the be confirm,Updates
Regarding bargain,was it discount bargain and for the was deal,Promotions
Regarding settings,so so but for account settings and that but that update and on,Updates
Regarding schedule,are deadline to schedule so it that,Primary
Regarding invite,of and or hangout be that video invite was or to or,Social
Regarding report,at report at project so the are,Primary
Regarding friend,and will will and family hangout for friend in,Social
Regarding save,be of save but so save the are this bargain,Promotions
Regarding team,office for project will so was on team in,Primary
Regarding share,is video but at was share of it is but are,Social
Regarding office,was or will be for on but in office that at team,Primary
Regarding settings,this or was at terms settings to so,Updates
Regarding party,this are and party but was is be photo,Social
Regarding security,that security in terms and or the confirm but will or in are,Updates
Regarding security,that will security password but of it on,Updates
Regarding policy,at update policy this is is will that,Updates
Regarding deadline,project team or is of will that it in so so and deadline,Primary
Regarding verify,it and will verify settings but to for this so are,Updates
Regarding account,to policy will be will the account will and,Updates
Regarding meeting,it project but is was this meeting at presentation,Primary
Regarding family,friend be family so and in will,Social
Regarding verify,and of on on will confirm but was verify to password at,Updates
Regarding share,of to and share but that of and for of family,Social
Regarding price,or be to it is discount that price price are but be meetup,Promotions
Regarding presentation,are that and meeting of was is in of was the presentation office,Primary
Regarding account,was verify is it so be so was account,Updates
Regarding update,be clearance update and for in be was or of verify,Updates
Regarding schedule,be or are at was schedule at discuss to team,Primary
Regarding deal,save the deal deal are in be will of or so in,Promotions
Regarding share,it be and but invite be but this it the share,Social
Regarding confirm,at settings but it and confirm the and login on the,Updates
Regarding project,schedule but to be or but and or or project it,Primary
Regarding offer,and at that save of will and offer discount be,Promotions
Regarding meeting,for office and or will meeting is meeting is it was it,Primary
Regarding discuss,so to on it for that at be discuss at office,Primary
Regarding sale,policy for for be sale and login of price deal this be but but,Promotions
Regarding dinner,and be video dinner deal will but is,Social
Regarding meetup,it to friend are meetup or be on that be party,Social
Regarding schedule,it report are are at so be was on schedule for,Primary
Regarding report,was meeting report on be for at to,Primary
Regarding sale,but at percent sale are on it and price,Promotions
Regarding team,that to team project for photo at but will was are discuss,Primary
Regarding party,meetup but party on to that was that hangout was be,Social
Regarding price,this save price that bargain or was report to,Promotions
Regarding settings,verify are are on or that on so be settings so password,Updates
Regarding hangout,meeting be share be was that presentation hangout it it,Social
Regarding deal,is and on are that the price the to of deal this,Promotions
Regarding account,be password was offer are but it account was for account but,Updates
Regarding friend,friend of are hangout at at so so,Social
Regarding share,for for so share at on this and at this and share share,Social
Regarding security,in confirm security for are so and share security,Updates
Regarding percent,on percent at so clearance price or that,Promotions
Regarding hangout,for password invite at for hangout the or it or account but but,Social
Regarding sale,clearance it will of sale and was at but and sale it,Promotions
Regarding password,password of confirm will or so be that or,Updates
Regarding meetup,meetup for to it that meetup to the dinner,Social
Regarding photo,or it photo friend at but to in photo it in but,Social
Regarding security,in so to security account so so so,Updates
Regarding office,that at and schedule are are for office it,Primary
Regarding sale,is at cheap be offer the sale the,Promotions
Regarding agenda,was are at agenda was it the so meeting or,Primary
Regarding clearance,is save will but or clearance on but are,Promotions
Regarding share,that this on so in share share will but,Social
Regarding report,that discuss the for so is report and be,Primary
Regarding clearance,at that or clearance are be this and and percent deal,Promotions
Regarding meetup,party on that but will or on it at this family meetup,Social
Regarding percent,that bargain in for that in clearance percent at,Promotions
Regarding bargain,to for it and bargain for for save so was the,Promotions
Regarding offer,this are on deal sale is will in offer,Promotions
Regarding video,in is party are at video for in dinner the are of are,Social
