subject,body,category
Regarding discuss,be discuss be or report deadline of or of in the on,Primary
Regarding percent,for bargain of the be percent or,Promotions
Regarding deal,this this to offer this was was of to is deal,Promotions
Regarding report,or this for this so meeting but report at to or is presentation,Primary
Regarding dinner,dinner was meetup is the it it dinner or,Social
Regarding update,account are policy update be for of is,Updates
Regarding sale,is sale offer will at is was,Promotions
Regarding deal,that of deal will deal deal on to are so,Promotions
Regarding verify,verify this update of it that so password,Updates
Regarding clearance,sale and clearance percent but at but so this,Promotions
Regarding meeting,in meeting team meetup for it in this meeting,Primary
Regarding family,will be family of and family and but to,Social
Regarding bargain,and that this on discount to or in bargain price or to,Promotions
Regarding meeting,the meeting it will to it but of office on at this,Primary
Regarding terms,was it will so of for on was terms and password,Updates
Regarding cheap,at discount cheap cheap or it share of this,Promotions
Regarding party,on friend to or and the in party,Social
Regarding security,it will security was to of settings the on is,Updates
Regarding policy,is so was will policy will the settings,Updates
Regarding deadline,of will but meeting are the is or deadline but deadline,Primary
Regarding party,to that in is that dinner party this is was and the,Social
Regarding family,of for video family is are of that hangout,Social
Regarding security,this in to policy in in security or to that the was,Updates
Regarding account,for verify at settings was are and was in account to of,Updates
Regarding hangout,are in hangout is of to family for so it,Social
Regarding policy,that security in to for is so so that will policy in,Updates
Regarding party,or party at at be party for,Social
Regarding project,this project office in but will to of team or,Primary
Regarding team,team that this be but meeting be at was are report are be,Primary
Regarding presentation,this presentation for so it is this or discuss that schedule in,Primary
Regarding verify,update are are this of in the in is verify,Updates
Regarding share,friend that share of it the in party but,Social
Regarding hangout,hangout will hangout family to that will it,Social
Regarding agenda,will agenda office in on that at,Primary
Regarding password,be but that was so will password password to,Updates
Regarding security,but terms are security on but this be of of and,Updates
Regarding party,at be and photo save to are was party cheap the was of dinner is,Social
Regarding agenda,deadline or so or of agenda and the,Primary
Regarding price,it the that save be in deal or price,Promotions
Regarding office,is at office schedule was at agenda party on this it to photo and or,Primary
Regarding share,share dinner but in to and on,Social
Regarding report,report will and is at that but report office,Primary
Regarding invite,so to share that invite is and hangout,Social
Regarding hangout,hangout for that and and it for hangout on this the so,Social
Regarding deal,this so are or in will are that price to deal will,Promotions
Regarding meetup,and friend meetup be for on photo so was at,Social
Regarding report,at report will at office schedule but or,Primary
Regarding schedule,it but so on schedule and but update agenda settings or is schedule,Primary
Regarding office,of this of be of on at office discuss,Primary
Regarding presentation,at it for to and report report are and the was presentation,Primary
Regarding photo,video so photo so for but meetup will,Social
Regarding report,and deadline but the at the report the,Primary
Regarding share,in photo the so be on share are,Social
Regarding update,on at will but and to update on password but,Updates
Regarding share,at of it is of share at family,Social
Regarding discount,discount will the that deal so the so,Promotions
Regarding share,and it and video are at share are,Social
Regarding hangout,will are dinner and will hangout and on meetup it are,Social
Regarding deal,the but save for will or percent will be it deal or on,Promotions
Regarding security,be this be will the are confirm security for in,Updates
Regarding clearance,clearance are to are be clearance save in or at will so,Promotions
Regarding bargain,percent discount this the be and was bargain,Promotions
Regarding friend,be for at friend or friend at was is deal,Social
Regarding offer,are offer so will will in it sale be but offer,Promotions
Regarding cheap,of on of the cheap on is cheap so it on,Promotions
Regarding offer,of at save the but this offer,Promotions
Regarding confirm,on login confirm of this will that,Updates
Regarding dinner,this dinner dinner will is for is so,Social
Regarding dinner,and to party dinner this hangout the and but office for for presentation of at,Social
Regarding report,office to or to or will project or report is,Primary
Regarding share,in the meetup share to to or in at,Social
Regarding confirm,terms it or was and will and confirm so this,Updates
Regarding invite,on invite or dinner was the on,Social
Regarding price,price or the was that for percent discount at,Promotions
Regarding discount,the this was will and discount to price to that are,Promotions
Regarding security,but on and for was to but hangout security photo in to terms but,Updates
Regarding clearance,it the was to clearance but offer for price so,Promotions
Regarding clearance,sale but or was offer will or but to at office so clearance agenda,Promotions
Regarding update,of was are settings team update update the this on that in,Updates
Regarding meetup,for will meetup share was that or so to clearance to dinner in,Social
Regarding update,on it the is will and be of update password for,Updates
Regarding save,save of sale the in on be this in it or are,Promotions
Regarding share,at hangout at share in the and in be to to,Social
Regarding deal,be price will or save was at is deal,Promotions
Regarding cheap,cheap but so be of and deal,Promotions
Regarding party,be and that party for hangout or on and,Social
Regarding policy,be that it login or at or in at to verify policy but,Updates
Regarding friend,for invite on that this it at friend in,Social
Regarding schedule,was project are save office so schedule the the so for is,Primary
Regarding account,in it the account was so terms of be the,Updates
Regarding office,was in that in presentation was team of the to office to,Primary
Regarding report,video that schedule the the office the for hangout report this are but to,Primary
Regarding presentation,to so project presentation and this on will for,Primary
Regarding agenda,discuss or be agenda the or but,Primary
Regarding account,account was will account of at it that or that,Updates
Regarding report,was so is report presentation team will of it,Primary
Regarding bargain,bargain it will this will percent be that was of,Promotions
Regarding photo,and or friend be photo the on photo for this or and,Social
Regarding account,to in the it of for at account password,Updates
Regarding dinner,or in family in party will so dinner,Social
Regarding deadline,of was report this are deadline so it at or,Primary
Regarding project,team or for on be project be or in for it,Primary
Regarding bargain,for bargain so be but this bargain it of will to save was,Promotions
Regarding save,it cheap or in will the save that so at that and,Promotions
Regarding friend,and be friend meetup to dinner in is for that or for be,Social
Regarding price,so for so clearance the of price will was,Promotions
Regarding confirm,of is account but will confirm in the confirm so at the,Updates
Regarding percent,of deadline so percent at will report discount the sale so,Promotions
Regarding save,at will so bargain is this in bargain but are save this on,Promotions
Regarding clearance,that for this the of clearance and is clearance,Promotions
Regarding verify,of verify so and so security will on be that policy,Updates
Regarding team,report but on will in price the team to but or of,Primary
Regarding deal,deal but percent but and it but be are cheap and,Promotions
Regarding schedule,is be but are agenda and hangout was at discuss that schedule be,Primary
Regarding confirm,be terms that security was are and is confirm and was at but,Updates
Regarding team,be to or so meeting will is at will of percent team it,Primary
Regarding party,party be in was that the on that invite,Social
Regarding team,this report but be team on so project will on or of,Primary
Regarding hangout,dinner photo are that login this of hangout be,Social
Regarding office,deadline is agenda and this is so so is office,Primary
Regarding account,is will are or account so is update are this,Updates
Regarding sale,on of sale save that of in deal to but that was be,Promotions
Regarding family,that but that in invite family in friend or be,Social
Regarding friend,will friend but friend this are at is on,Social
Regarding office,office team at was but at was be of,Primary
Regarding discuss,was at so discuss that this is to presentation it to,Primary
Regarding report,so be was are presentation save for deal deadline report,Primary
Regarding policy,or will login but that is policy at,Updates
Regarding meeting,in or on will and report meeting in on on on was team,Primary
Regarding terms,on was are in at the and or account terms at,Updates
Regarding cheap,was and on so clearance are cheap,Promotions
Regarding save,and of to it it cheap verify be was bargain this be save,Promotions
Regarding policy,so is policy update it for security is in,Updates
Regarding update,be be update terms of to and,Updates
Regarding bargain,that bargain and this bargain it that,Promotions
Regarding account,to at are update login account will is at,Updates
Regarding price,or or offer update or that to at price to it this,Promotions
Regarding update,share to is settings account hangout this and update so,Updates
Regarding sale,but the of was sale was but clearance are price,Promotions
Regarding security,are security of will security be the,Updates
Regarding login,so but or at is login is confirm but login of friend in this,Updates
Regarding deadline,and verify on deadline at will discuss at be this security that,Primary
Regarding save,was for the this cheap will save and that clearance,Promotions
Regarding friend,so the family friend be at are for is,Social
Regarding price,that to so and cheap price bargain but are is or so that,Promotions
Regarding confirm,will settings so this confirm for and on,Updates
Regarding dinner,meetup the and dinner are at on meetup,Social
Regarding cheap,for cheap will discount is bargain to so be,Promotions
Regarding clearance,clearance is the was clearance price to be for in and was on,Promotions
Regarding update,are are was and on update update for,Updates
Regarding project,so will in meetup office project be it it,Primary
Regarding meeting,and meeting deadline in that so this to,Primary
Regarding dinner,are dinner it are invite hangout that to this are for,Social
Regarding terms,or for is at or terms on settings of at and is,Updates
Regarding friend,are video friend family on and that at the that,Social
Regarding party,or friend invite on but login this party be account be,Social
Regarding meeting,but on on for be to at and team meeting at but,Primary
Regarding report,so report it to and that at be report this,Primary
Regarding save,for and at in and save discount for for that account update or was,Promotions
Regarding policy,are in will and update to policy that,Updates
Regarding offer,on offer are price or the on,Promotions
Regarding video,will photo video and friend will will are,Social
Regarding verify,that so that to policy that be verify are are was for,Updates
Regarding deadline,and at this or deadline to and project to,Primary
Regarding sale,this this was to at clearance sale percent this will,Promotions
Regarding confirm,in of for terms and confirm of clearance password and to will will are,Updates
Regarding confirm,of the or settings confirm on are was are,Updates
Regarding invite,be or is it clearance will at share was family invite that of for,Social
Regarding agenda,the it for so agenda that of but it it meeting,Primary
Regarding dinner,the dinner be friend friend this on it this,Social
Regarding policy,on hangout be are in is friend policy in be policy this so be,Updates
Regarding confirm,was confirm the account it but are of is on,Updates
Regarding team,be this in team that office project and and at,Primary
Regarding policy,it of for but that policy at verify and the the are,Updates
Regarding update,login it update to for that are and terms but it,Updates
Regarding schedule,schedule that this of in was that it meeting will,Primary
Regarding clearance,for of of is clearance so in sale are at,Promotions
Regarding agenda,it is so will deadline was for be the was deadline agenda,Primary
Regarding policy,but be it password policy at in policy but for,Updates
Regarding password,or and or policy at be password confirm so at that or,Updates
Regarding invite,for invite in but in this are invite on party to and in,Social
Regarding deal,and percent for deal at but or was was on,Promotions
Regarding verify,presentation this will security was for in policy and verify,Updates
Regarding video,but photo this was be so it video on meetup,Social
Regarding policy,verify of and policy it this and is,Updates
Regarding bargain,are but will bargain but to percent this bargain and was but,Promotions
Regarding invite,on family it and this the to are will invite photo this for,Social
Regarding login,be discuss security account it are in to but be be so and login,Updates
Regarding video,the cheap that but video in or deal that video,Social
Regarding save,percent are of save for cheap this are are be,Promotions
Regarding friend,in that on and are party be and for but friend hangout,Social
Regarding share,so share this are this on friend,Social
Regarding update,confirm this the update so password of or,Updates
Regarding security,are security or is login to is was at and account but and,Updates
Regarding meeting,to is discuss was team meeting and this,Primary
Regarding save,to will save be was to cheap,Promotions
Regarding schedule,office will the it invite and schedule be or,Primary
Regarding friend,dinner be will are at are friend to was,Social
Regarding offer,but offer or that or be cheap the for in bargain,Promotions
Regarding share,on share family friend but in so that or,Social
Regarding presentation,will of presentation be report schedule is this was at this,Primary
Regarding terms,so the this terms so verify update or on,Updates
Regarding team,is photo so is so that office on are on will team,Primary
Regarding invite,but video the video office and invite for be deadline it,Social
Regarding terms,but it on login terms of on so so,Updates
Regarding video,in video at invite is are or is this and is,Social
Regarding report,discuss for be be in be security of report,Primary
Regarding presentation,was and be agenda on presentation will or,Primary
Regarding photo,photo at for on be was photo for,Social
Regarding project,presentation will is project settings this are to at of verify will of deadline be,Primary
Regarding report,and at but meeting or so report on team and,Primary
Regarding dinner,the on dinner to will in dinner was on on,Social
Regarding share,for in so share will this but on was share it of,Social
Regarding cheap,for is it cheap price are that but to are to,Promotions
Regarding clearance,that or for on at or clearance to on bargain save,Promotions
Regarding family,and and discuss on the the or hangout family meeting was,Social
Regarding bargain,but bargain so bargain was or at,Promotions
Regarding meeting,for is discuss at meeting be or but meeting this it,Primary
Regarding percent,are on will price on to this to this cheap percent in be,Promotions
Regarding meeting,this schedule presentation was on will meeting is,Primary
Regarding party,terms are security friend this the will family the this party for in in in,Social
Regarding invite,this it of but invite at to invite the for,Social
Regarding meetup,photo meetup that of in on but of the to,Social
Regarding login,terms terms this or it that are login in to discuss was be,Updates
Regarding project,for are project or schedule but this the on at to project that,Primary
Regarding team,party be this will of this report team so,Primary
Regarding photo,are so will in family for will on will photo,Social
Regarding share,or dinner in of that to share and but,Social
Regarding friend,and or on are friend meeting photo for be meeting,Social
Regarding party,be for so it will will or photo but party or to,Social
Regarding save,to sale this save are that so,Promotions
Regarding verify,that this verify and this it to confirm,Updates
Regarding sale,sale offer but was is for are team,Promotions
Regarding settings,of verify that are are of settings in security on of of,Updates
Regarding account,is and but is so account login in for that,Updates
Regarding family,the family but dinner is for that but,Social
Regarding password,this so is the password for settings at so was so,Updates
Regarding offer,or but so it on sale offer of or is of will,Promotions
Regarding family,video family or account login this in at or to that to for,Social
Regarding report,was and are report schedule the and this it on,Primary
Regarding video,and and of the was on at will are dinner video so,Social
Regarding deal,will the it the sale this deal this or are will,Promotions
Regarding deal,deal this on to be offer was,Promotions
Regarding discuss,for and discuss to team so will it or but was that,Primary
Regarding share,for this it for share share at,Social
Regarding sale,deal sale to is for bargain this at on at,Promotions
Regarding presentation,will be or presentation to so report,Primary
Regarding clearance,price was clearance this or of save that was discuss,Promotions
Regarding save,is is or save is sale cheap to,Promotions
Regarding confirm,policy confirm will of the settings will to,Updates
Regarding meetup,invite on or it be meetup is deal,Social
Regarding security,it verify update at at security the this bargain,Updates
Regarding family,it friend photo of this to this so on family,Social
Regarding deal,in or this the and deal bargain on,Promotions
Regarding team,office are will are team office this the,Primary
Regarding offer,be price at price offer family of on on be video of to on,Promotions
Regarding office,presentation hangout to office of at the of that this of or friend team or,Primary
Regarding dinner,update are was account and the dinner be or dinner,Social
Regarding report,is to of in at meeting are report,Primary
Regarding project,project of are are are project for report,Primary
Regarding presentation,so to and presentation agenda or the the of that that,Primary
Regarding presentation,at on are team is presentation and was,Primary
Regarding offer,discuss for so office offer but percent will at at the this discount for,Promotions
Regarding percent,the percent of in on price percent be meeting,Promotions
Regarding password,to was that in password confirm so will for on to that,Updates
Regarding account,account is are at on for this was settings at,Updates
Regarding meeting,in to that that project at meeting was,Primary
Regarding sale,it in are and sale was are so discount is,Promotions
Regarding friend,of security are that share on at friend,Social
Regarding share,to friend be or that but settings are family share is,Social
Regarding account,or settings or but account so of deadline account project for or at,Updates
Regarding share,are and account on will share share is that,Social
Regarding hangout,hangout be share to of for share this for but,Social
Regarding team,so was was of is team agenda but it and be,Primary
Regarding video,but video at was will or video family for or and it,Social
Regarding security,will will security will confirm so is account this for but,Updates
Regarding sale,in sale to on so price clearance and is,Promotions
Regarding schedule,office and at be at it meeting is schedule,Primary
Regarding video,video the invite on is family on but or was for that,Social
Regarding policy,at login in on are to password at but policy of,Updates
Regarding confirm,be but it that this update so on to terms confirm are is,Updates
Regarding sale,it are be sale that be deal this,Promotions
Regarding cheap,cheap on and is to is this it sale this are,Promotions
Regarding cheap,but cheap will that to or it sale will but are,Promotions
Regarding presentation,project are presentation discuss be to is this,Primary
Regarding meetup,the to it the for for hangout was meetup are this,Social
Regarding terms,and percent for be terms password is but policy in on was will in,Updates
Regarding password,password was password to is be password at of it will,Updates
Regarding meeting,meeting are that to report meeting be the,Primary
Regarding save,it save is deal or and of this or but to are cheap,Promotions
Regarding schedule,the schedule was terms of is confirm meeting this office of,Primary
Regarding clearance,the but in was but clearance deal for,Promotions
Regarding discuss,on for report at the discuss and,Primary
Regarding invite,at so be meetup was at the in of invite or,Social
Regarding family,are of to dinner family is and,Social
Regarding account,so price verify and terms be at or save account and,Updates
Regarding invite,for it invite at but and invite be,Social
Regarding sale,sale deal it friend but are on are,Promotions
Regarding security,security but was be the but terms on to at is confirm,Updates
Regarding price,price of that deal to sale or be to,Promotions
Regarding security,security it this discount is or to update is,Updates
Regarding team,it be in so team schedule this and meeting,Primary
Regarding password,but discuss on login is at verify in will password,Updates
Regarding team,and to that at are is presentation be team,Primary
Regarding update,this update that on to are to update update be on was on,Updates
Regarding team,are at will team will it and it the be office team is,Primary
Regarding sale,is discount price or so and for the is sale it and,Promotions
Regarding clearance,was was clearance are at and are that or clearance so to,Promotions
Regarding office,are this to report schedule on but office,Primary
Regarding discount,in but or on cheap discount save to but and,Promotions
Regarding meeting,that for of so in or meeting at in and was deadline,Primary
Regarding percent,are so was for at it clearance percent of,Promotions
Regarding policy,are so or office confirm the are this policy that that verify report in this,Updates
Regarding password,is on will or and password in is the of verify,Updates
Regarding security,policy be is account is security it that,Updates
Regarding discuss,be discuss so are agenda or meeting of be the be the at,Primary
Regarding invite,but invite this are photo and that but or will,Social
Regarding project,or it at the hangout to photo at at it to project schedule be,Primary
Regarding policy,is at login at the policy that or will was,Updates
Regarding photo,are dinner but this family photo will it clearance are,Social
Regarding meetup,in share on bargain share meetup but it at,Social
Regarding price,be it save price and save or at be,Promotions
Regarding report,so this office this on but at report are discuss,Primary
Regarding deal,is in deal or discount discount it that the in or,Promotions
Regarding bargain,this will of the at will in save or bargain,Promotions
Regarding offer,offer to and are on for it schedule percent sale is,Promotions
Regarding photo,was that are but photo for it video,Social
Regarding report,to report are for this be so it it was team,Primary
Regarding dinner,dinner this share it on deadline it project was be that to,Social
Regarding confirm,is settings this and so in or terms confirm,Updates
Regarding deal,of but was will it discuss of team on but cheap the deal,Promotions
Regarding schedule,schedule be in and in to it are on discuss,Primary
Regarding office,this on and that it discuss report office,Primary
Regarding account,it and in but account verify so login,Updates
Regarding meeting,that meeting this was was is in office to the,Primary
Regarding family,at is party for on is at are family photo be is for,Social
Regarding party,that in it it on be party invite is,Social
Regarding video,are video it family to that the in will clearance on or,Social
Regarding price,for sale it or is so price offer,Promotions
Regarding password,that are was was on password is the password,Updates
Regarding policy,will terms will will update of be that was are policy the,Updates
Regarding confirm,it policy of it confirm it security at but will the,Updates
Regarding party,of it and at meetup invite is party of,Social
Regarding login,dinner on on settings so and will but it invite login or,Updates
Regarding cheap,for at cheap save be but that offer party,Promotions
Regarding family,are photo to discuss but family are share in of this,Social
Regarding report,this of this meeting schedule or and report is,Primary
Regarding discount,bargain will of and so save for of discount of,Promotions
Regarding schedule,team this of or schedule will is project,Primary
Regarding offer,will on at discount cheap offer is the be of,Promotions
Regarding sale,in but was clearance in will are in sale are,Promotions
